{
  "$schema": "https://nextjshx.dev/schemas/test-lanes.schema.json",
  "schemaVersion": 2,
  "selectionMode": "observation",
  "confidenceWindow": {
    "minimumRuns": 30,
    "minimumDays": 14,
    "resetOnMiss": true
  },
  "fullBackstops": {
    "main": true,
    "nightly": true,
    "release": true
  },
  "productSurfaces": [
    {
      "id": "repository-governance",
      "name": "Repository testing and governance",
      "status": "partial",
      "claims": ["The test topology, policy checks, and failure propagation remain deterministic and fail closed."],
      "authoredInputs": ["Repository policy, workflow, lane manifest, and contributor instructions"],
      "producedOutputs": ["Validated test plan, policy result, and structured lane records"],
      "supportedProfiles": ["repository-internal"],
      "requiredEvidence": ["test-topology", "governance", "security"],
      "laneIds": ["loop.validate", "loop.self", "docs.general", "seed.plan", "architecture", "security.tooling"],
      "oracles": [
        {
          "kind": "invariant",
          "source": "Schema validation, fail-safe selector rules, and deliberate nonzero/timeout controls",
          "pin": null
        }
      ],
      "selectorOwnership": "Changes to the topology, workflows, hooks, policy, or an unknown path expand to the complete manifest.",
      "fullBackstopCommand": "npm run public:preflight",
      "releaseCommand": "npm run public:preflight",
      "knownLimitations": ["Internal governance evidence does not establish application or framework behavior."],
      "owner": "NextJsHx maintainers",
      "archetype": "security",
      "testedProfiles": ["repository-internal"],
      "focusedOwners": ["loop.validate", "loop.self", "docs.general", "seed.plan", "architecture", "security.tooling"],
      "verticalIntegrationOwners": [],
      "realRuntimeOrSystemOwners": [],
      "browserE2EOwners": [],
      "evidenceOwners": [
        {
          "evidence": "test-topology",
          "laneIds": ["loop.validate", "loop.self", "docs.general"]
        },
        {
          "evidence": "governance",
          "laneIds": ["loop.validate", "loop.self", "seed.plan", "architecture", "security.tooling"]
        },
        {
          "evidence": "security",
          "laneIds": ["security.tooling"]
        }
      ],
      "examples": [],
      "adaptations": ["The selector remains observation-only and unknown ownership expands to the full suite."],
      "knownSkips": ["Internal governance evidence does not establish application or framework behavior."],
      "quarantines": [],
      "lastCleanProof": null,
      "residualRisks": ["Internal governance evidence does not establish application or framework behavior."],
      "profileOwners": [
        {
          "profile": "repository-internal",
          "laneIds": ["loop.validate", "loop.self", "docs.general", "seed.plan", "architecture", "security.tooling"]
        }
      ]
    },
    {
      "id": "haxe-generation",
      "name": "Haxe authoring and Genes generation",
      "status": "partial",
      "claims": ["Supported Haxe and HXX declarations are checked before output and generate deterministic TypeScript/TSX that passes independent target checks."],
      "authoredInputs": ["Repository-owned Haxe/HXX declarations and exact public package bindings"],
      "producedOutputs": ["Genes TypeScript/TSX implementation modules and NextJsHx adapter plans"],
      "supportedProfiles": ["typescript/optimized"],
      "requiredEvidence": ["haxe-positive", "haxe-negative", "determinism", "strict-typescript"],
      "laneIds": ["haxe.positive", "haxe.negative", "adapter.plan", "route.patterns", "page.layouts", "metadata.segment", "route.handlers", "special.files", "proxy", "route.hrefs", "environment.boundaries", "clientification.boundaries", "client.components", "mdx.components", "content.blocks", "server.functions", "cache.boundaries", "codecs", "next.bindings", "next.core.navigation", "next.components", "next.server", "showcase.ui", "integration.dnd-kit", "integration.recharts", "integrations.runtime", "snapshots", "compiler.gaps", "fixture.stable.primary"],
      "oracles": [
        {
          "kind": "pinned-differential",
          "source": "Pinned Haxe 4.3.7 and Genes 1.50.0 contracts recorded by support_matrix.json",
          "pin": "Haxe 4.3.7; genes-ts 1.50.0"
        },
        {
          "kind": "real-consumer",
          "source": "Strict TypeScript 6.0.2 and public Next/React declarations",
          "pin": "TypeScript 6.0.2; Next 16.2.12; React 19.2.7"
        }
      ],
      "selectorOwnership": "Haxe, macro, binding, and generated-shape owners select focused diagnostics plus declared target/build consumers.",
      "fullBackstopCommand": "npm run public:preflight",
      "releaseCommand": "npm run public:preflight",
      "knownLimitations": ["NextJsHx does not claim the official Haxe target suite; generic compiler conformance remains owned by Genes.", "JavaScript/reviewable profile cells are not yet release claims."],
      "owner": "NextJsHx maintainers",
      "archetype": "compiler",
      "testedProfiles": ["typescript/optimized"],
      "focusedOwners": ["haxe.positive", "haxe.negative", "adapter.plan", "route.patterns", "page.layouts", "metadata.segment", "special.files", "proxy", "mdx.components", "next.core.navigation", "next.components", "showcase.ui", "snapshots"],
      "verticalIntegrationOwners": ["next.bindings"],
      "realRuntimeOrSystemOwners": ["route.handlers", "route.hrefs", "environment.boundaries", "clientification.boundaries", "content.blocks", "cache.boundaries", "codecs", "next.server", "integration.dnd-kit", "integration.recharts", "integrations.runtime", "compiler.gaps", "fixture.stable.primary"],
      "browserE2EOwners": ["client.components", "server.functions"],
      "evidenceOwners": [
        {
          "evidence": "haxe-positive",
          "laneIds": ["haxe.positive", "adapter.plan", "route.patterns", "page.layouts", "metadata.segment", "route.handlers", "special.files", "proxy", "route.hrefs", "client.components", "mdx.components", "content.blocks", "codecs", "next.bindings", "next.core.navigation", "next.components", "next.server", "showcase.ui", "integration.dnd-kit", "integration.recharts", "integrations.runtime", "compiler.gaps", "fixture.stable.primary"]
        },
        {
          "evidence": "haxe-negative",
          "laneIds": ["haxe.negative", "adapter.plan", "route.patterns", "page.layouts", "metadata.segment", "route.handlers", "special.files", "proxy", "route.hrefs", "environment.boundaries", "client.components", "mdx.components", "content.blocks", "server.functions", "cache.boundaries", "codecs", "next.bindings", "next.core.navigation", "next.components", "next.server", "showcase.ui", "integration.dnd-kit", "integration.recharts", "integrations.runtime", "compiler.gaps"]
        },
        {
          "evidence": "determinism",
          "laneIds": ["adapter.plan", "route.patterns", "page.layouts", "metadata.segment", "route.handlers", "special.files", "proxy", "environment.boundaries", "clientification.boundaries", "client.components", "server.functions", "cache.boundaries", "next.bindings", "snapshots", "fixture.stable.primary"]
        },
        {
          "evidence": "strict-typescript",
          "laneIds": ["page.layouts", "metadata.segment", "route.handlers", "special.files", "proxy", "route.hrefs", "client.components", "mdx.components", "content.blocks", "server.functions", "cache.boundaries", "codecs", "next.core.navigation", "next.components", "next.server", "showcase.ui", "integration.dnd-kit", "integration.recharts", "integrations.runtime", "compiler.gaps", "fixture.stable.primary"]
        }
      ],
      "examples": ["showcase-ui", "showcase-field-atlas"],
      "adaptations": ["NextJsHx owns focused downstream Next composition; generic Haxe-to-JS/TS conformance remains in Genes."],
      "knownSkips": ["NextJsHx does not claim the official Haxe target suite; generic compiler conformance remains owned by Genes.", "JavaScript/reviewable profile cells are not yet release claims."],
      "quarantines": [],
      "lastCleanProof": null,
      "residualRisks": ["NextJsHx does not claim the official Haxe target suite; generic compiler conformance remains owned by Genes.", "JavaScript/reviewable profile cells are not yet release claims."],
      "profileOwners": [
        {
          "profile": "typescript/optimized",
          "laneIds": ["haxe.positive", "haxe.negative", "adapter.plan", "route.patterns", "page.layouts", "metadata.segment", "route.handlers", "special.files", "proxy", "route.hrefs", "environment.boundaries", "clientification.boundaries", "client.components", "mdx.components", "content.blocks", "server.functions", "cache.boundaries", "codecs", "next.bindings", "next.core.navigation", "next.components", "next.server", "showcase.ui", "integration.dnd-kit", "integration.recharts", "integrations.runtime", "snapshots", "compiler.gaps", "fixture.stable.primary"]
        }
      ]
    },
    {
      "id": "package-cli",
      "name": "NextJsHx package, CLI, and generated-project topology",
      "status": "partial",
      "claims": ["The CLI discovers projects, refuses ownership conflicts, publishes generated output transactionally, and remains usable from a clean packed consumer."],
      "authoredInputs": ["Project configuration, Haxe source roots, native Next files, and CLI commands"],
      "producedOutputs": ["Owned adapter trees, manifests, diagnostics, and packed consumer artifacts"],
      "supportedProfiles": ["typescript/optimized"],
      "requiredEvidence": ["cli", "ownership", "determinism", "clean-consumer", "security"],
      "laneIds": ["cli.preparation", "cli.config", "cli.ownership", "cli.publication", "cli.commands", "cli.all", "cli.dev", "package.shape", "example.mixed.source", "example.mixed.full", "fixture.stable.primary", "fixture.stable.matrix"],
      "oracles": [